{
  "key": "vanity",
  "name": "Vanity",
  "maneuverType": "general",
  "superiorityDice": 1,
  "description": "When you reduce a hostile creature to 0 hit points, you can expend and roll a superiority die (no action required), regaining a number of hit points equal to the result of the roll + your maneuver ability modifier.",
  "sourceKey": "phb",
  "contentSet": "core"
}
