{
  "key": "fast-access-programs",
  "name": "Fast Access Programs",
  "maneuverType": "mental",
  "superiorityDice": 1,
  "prerequisite": "The ability to cast tech powers",
  "description": "When you cast a tech power of 1st-level or higher that has a casting time of 1 action, you can expend a superiority die to change the casting time to 1 bonus action for this casting.",
  "sourceKey": "phb",
  "contentSet": "core"
}
